heading,content,start,end,tokens,title
0, The Joe Rogan Experience,0.0,6.0,7,Mike_Tyson
1, Train my day Joe Rogan podcast my night all day,6.0,10.0,13,Mike_Tyson
2, So friend giant boxing fan he sends me this text message he goes dude check this shit out and it's you training with,12.0,20.400000000000002,26,Mike_Tyson
3, Half-El Cordero and I remember looking at it and going oh shit what happened,20.400000000000002,25.76,19,Mike_Tyson
4, What happened because the last time you were in here you were talking about how you didn't want to work out,26.240000000000002,30.64,24,Mike_Tyson
5," Yeah, cuz it would ignite the ego",30.8,33.28,10,Mike_Tyson
6," Hey, let's talk about that too",33.92,35.92,10,Mike_Tyson
7, So um,36.24,37.92,4,Mike_Tyson
8, I was discussing my wife something about me being overweight you know me have to get some time for like a plan in your wife,37.92,44.0,27,Mike_Tyson
9, Will you wouldn't pick her around some kind of perspective and she said well wanted you to get on this,44.0,49.2,23,Mike_Tyson
10, Trident for 15 minutes a day. I thought she said just 15 minutes or it went from 15 minutes a day to two hours a day,49.84,56.480000000000004,30,Mike_Tyson
11, And um,57.36,59.36,4,Mike_Tyson
12, That's what you were worried about yeah exactly um,59.68000000000001,62.88,12,Mike_Tyson
13, I was complaining about my weight and so um I,63.68000000000001,66.88,12,Mike_Tyson
14, I don't know I guess I tried on some clothing. It was disastrous,68.16,71.44,17,Mike_Tyson
15, And so I was worried about my weight and she told me the 15 minute round to win two hours a day and um,71.92,78.48,26,Mike_Tyson
16, I just started losing weight and then um somebody came on personal and said hey Mike,79.44,83.76,18,Mike_Tyson
17, I know you're not gonna want but somebody said would you fight this guy for like 40 million 30 million but I said man,83.76,89.36,27,Mike_Tyson
18, Get the fuck out of my world. I said hold this is a thing,89.36,92.16,17,Mike_Tyson
19, I said whoa,93.76,95.76,5,Mike_Tyson
20, I said well who would they like me to fight and said one minute and then it's Bob's hat,95.76,100.96000000000001,23,Mike_Tyson
21," But okay, and so I'm saying to myself well, I know Bob",101.04,104.24000000000001,17,Mike_Tyson
22, I said no,105.11999999999999,106.39999999999999,5,Mike_Tyson
23, Because I know Bob is digging strong. I said hold one minute,106.39999999999999,109.36,15,Mike_Tyson
24, How would they like me to fight him kind of fight him in the market for Queen Mary rule and he said one minute Mike,110.64,115.44,27,Mike_Tyson
25," He asked the guy the guy said yes, I said I fight him right and so this Bob Sap was the first one that was brought up",115.75999999999999,121.84,30,Mike_Tyson
26," Yeah, and so once and for people don't know Bob Sap Bob Sap was a giant fighter and pride at one time",122.08,127.67999999999999,26,Mike_Tyson
27, He was like three hundred seventy five pounds and fighting all the kickboxers solid muscle and abs,127.67999999999999,132.8,21,Mike_Tyson
28," Yes, incredible right and um it went from him to somebody else and another guy in the man",133.12,138.16000000000003,21,Mike_Tyson
29, The niska and then somehow know some other fighters vandered and went from,138.16000000000003,142.48000000000002,19,Mike_Tyson
30, Who else was another heavyweight champ?,143.76000000000002,145.52,10,Mike_Tyson
31, We just a bunch of guys up here ain't fight and they say you know,145.52,148.64000000000001,18,Mike_Tyson
32," It came down the road. I had to do and I'm like, I don't know what the hell is going on",149.44,153.60000000000002,27,Mike_Tyson
33," And then he signed the contract I signed the contract next thing. No, I'm in the gym again",153.60000000000002,158.72000000000003,23,Mike_Tyson
34, And this disaster is I'm trying to get in the shape. I'm saying it my,159.04000000000002,162.4,20,Mike_Tyson
35, Really do this shit,162.8,164.8,6,Mike_Tyson
36, You know you you would probably know because if you,166.0,169.20000000000002,12,Mike_Tyson
37, Getting in shape and getting conditioned the two different animals. They don't even belate,169.92000000000002,174.24,19,Mike_Tyson
38, belong in the same,174.88000000000002,176.88000000000002,6,Mike_Tyson
39, Work out the vision of working out like it in shape is just being kind of fit. Yes,177.12,182.48000000000002,21,Mike_Tyson
40, You know getting in shape is able to fit your clothes right right? You know that's getting in shape being able,183.12,188.24,25,Mike_Tyson
41, You have to fit your clothes being in condition is being able to come outside of your soul,188.24,194.16,20,Mike_Tyson
42," Yeah, you can't do that automatically. You're talking about being in fighting conditions. Yes. Yeah. Yeah, that's a rare state",196.0,202.88,31,Mike_Tyson
43," And you can't keep it for very long. No, it is just people need to understand that right the emotional state to prepare for that is",203.04000000000002,210.0,31,Mike_Tyson
44, Oh my,210.88,212.88,4,Mike_Tyson
45," Well, that's what I was seeing when I was seeing you hit the pads",212.88,215.36,18,Mike_Tyson
46, I'm like this isn't just working out there was something going on man when you were working out with Cordero,215.44000000000003,219.76000000000002,25,Mike_Tyson
47, And you rip into the body and throw in those hooks. I was like this isn't man who's preparing to go to combat,219.76000000000002,224.72000000000003,28,Mike_Tyson
48, This is not normal getting ready to work out shit. That's why when I saw that video. I was like oh,224.8,229.52,26,Mike_Tyson
49," I'm gonna take something about that video. Yeah, I did that video and I was in bed for a week",229.52,234.32000000000002,25,Mike_Tyson
50, That was 30 seconds and I was in bed for a week,235.28000000000003,237.92000000000002,14,Mike_Tyson
51, And it's not funny because it made me realize that this is this is this is big boy shit,238.8,243.76000000000002,22,Mike_Tyson
52," Okay, this big boy shit you with that is right there. That wasn't really cool. That's in the gym. That's now the thing is though",243.84,251.2,34,Mike_Tyson
53," That's now that's that's going for you know five and six rounds. That's now, but I'm talking about before that 30 seconds",251.67999999999998,257.84,31,Mike_Tyson
54, The first time I ever did it I could um,258.08,261.12,12,Mike_Tyson
55," What's the shit you could when you can't oh, sorry, I had everything came and everything all that shit",262.4,267.12,25,Mike_Tyson
56, They came back to make me quit boxing all those pains started coming back,267.44,270.48,16,Mike_Tyson
57," So when you started training again, did you start doing it slowly after that extremely slowly and then I started um",271.12,278.16,24,Mike_Tyson
58, dabbing in an alternative stuff like what kind of stuff,278.88,281.76,13,Mike_Tyson
59, Priot therapy type shit cryo,282.88,285.36,9,Mike_Tyson
60, stem cell research and therapy and some other interesting stuff that I don't know and this is just beautiful stuff like what kind of stuff,286.8,295.84000000000003,28,Mike_Tyson
61, I don't know hyperbaric chamber than just everything everything to help you recover,296.64,303.91999999999996,18,Mike_Tyson
62, It's really interesting. It is it well. I saw you when you walked in today. I was like god damn you look good,304.71999999999997,310.15999999999997,29,Mike_Tyson
63," You look good dude, like your muscles look good. You look like your vascular you look fit and that's um",310.56,317.76,26,Mike_Tyson
64, And I'm starting to feel fit,319.52,321.52,9,Mike_Tyson
65, That's what's interesting. I know what they do and stuff like I think I'm in shape and then the next thing you know,322.08,327.59999999999997,29,Mike_Tyson
66, You think you're in shape and then you start having like um rafia start throwing punches at me,328.32,332.96,23,Mike_Tyson
67, It's like a fight and I can't punch back like I got a boy and then two rounds go by you need to whoa,333.12,337.84,28,Mike_Tyson
68, I'm not in shape. I'm in the bag six rounds. I'm doing this three five round six and I'm jumping rope,337.84,342.56,29,Mike_Tyson
69, And then I do two rounds of somebody is a whole different psychological,342.79999999999995,346.15999999999997,15,Mike_Tyson
70, Corporation and who how much how much time has gone since you first started exercising like when did it's when did it start,346.64000000000004,353.84000000000003,26,Mike_Tyson
71, So here we are with like august 23rd or something like that,355.68,358.32000000000005,16,Mike_Tyson
72, 22nd what when did when did it start?,359.52000000000004,361.76000000000005,12,Mike_Tyson
73, I had to start um,362.64000000000004,364.64000000000004,7,Mike_Tyson
74, Something like April April so want something like that in the middle of the lockdown,366.72,371.44000000000005,17,Mike_Tyson
75," Yeah, so you just just started just training",371.68,374.72,11,Mike_Tyson
76, And now here you are five months later four months later,375.20000000000005,378.48,13,Mike_Tyson
77, How far away do you think you are to being in like fighting shape? Oh,380.16,383.84000000000003,18,Mike_Tyson
78," Fighting shape one of the time come back by um november 28th. Yeah, that's when you'd be ready exactly",384.0,389.84000000000003,27,Mike_Tyson
79," Now, why did you guys decide to move you were supposed to be in September right was supposed to be",390.72,394.8,23,Mike_Tyson
80, We're the viewing um situation,394.8,397.76000000000005,8,Mike_Tyson
81," Um at the proper timing for more people for audiences. Yeah, yeah",398.64000000000004,403.28000000000003,16,Mike_Tyson
82, That nature it's so exciting,403.76,405.28,8,Mike_Tyson
83, So it's gonna be awesome because um it's gonna be um me and everyone else that's involved arrows and anyone,406.08,412.71999999999997,25,Mike_Tyson
84, Innovation then we're gonna start off the legends only league and that's gonna be really,413.84,418.47999999999996,19,Mike_Tyson
85, Breath taking especially starting off with me and Roy,419.2,421.44,11,Mike_Tyson
86," Yeah, and um I'm looking forward to that to have actually from every general it's",421.91999999999996,427.2,20,Mike_Tyson
87, On a ray of everybody who was,427.92,429.92,9,Mike_Tyson
88, Who believed the someone they all gonna come back and all feels and this will be something that mean um,430.47999999999996,436.88,22,Mike_Tyson
89, The arrows and the ventures created together and I think this is gonna be pretty awesome,437.36,441.92,19,Mike_Tyson
90, So legends only league would be like all sports baseball,442.0,444.64,12,Mike_Tyson
91," Yes, I think maddening and crazy like we did with Billie Jean that came to have somebody yes say",447.03999999999996,452.4,24,Mike_Tyson
92, One of the serene and somebody playing mac and roll and that kind of stuff right exhibitions and stuff like that or somebody like um,452.71999999999997,459.76,28,Mike_Tyson
93," Man-a-war complete one-on-one with whoever I ever seen or somebody yeah, I mean men at peace",461.2,466.64,27,Mike_Tyson
94, Men awards the horse,467.52,469.52,6,Mike_Tyson
95," Metamorphose yeah, yeah, no, it's a amazing idea, but particularly for you like seeing you hit the bag again",470.96,478.23999999999995,28,Mike_Tyson
96, And seeing you hit the pads and get excited about it. It was very very interesting to me,478.32,482.32,21,Mike_Tyson
97, Because I knew that you had that thing in your head where you didn't want to ignite your ego,482.8,486.88,22,Mike_Tyson
98, And then you had this quote that the gods of war reignited your ego,486.88,490.8,17,Mike_Tyson
99, I read that I got so excited,491.44,493.44,9,Mike_Tyson
100," Well, that's the excuse I can use you know, I think really great excuse that I can use",494.72,499.2,23,Mike_Tyson
101, But it's uh it was a great quote and made me excited and I when I'm when I'm seeing you training,500.48,505.28000000000003,26,Mike_Tyson
102," I mean, you know, so some people that",505.36,507.36,12,Mike_Tyson
103, In everybody has opinions when something like this happens when a man is 53 now you 54,508.56,513.36,19,Mike_Tyson
104, Yeah 54 and decides to fight again,513.52,515.84,9,Mike_Tyson
105, It's as fit as you look like why not why not why not you could do whatever you want why can't I mean if you can go bungee jumping and ride a ball,516.88,524.16,38,Mike_Tyson
106, It's not,524.4,526.4,5,Mike_Tyson
107, Impossible is nothing to somebody that tries,526.48,529.2,9,Mike_Tyson
108," Everything that someone said was impossible is happened. Yeah, it's certainly well listen in 2020 with all the ways of recovering",529.92,537.92,26,Mike_Tyson
109," All the things we know the sanitation is create impossible. Well, it's different now limitations are different now exactly",537.92,544.4799999999999,24,Mike_Tyson
110, So when you like that video when you were ripping the pads and working out with half El Cordero,544.8,550.4799999999999,22,Mike_Tyson
111, How many like how long into that was that like how how quickly did you get your speed back?,550.88,555.12,22,Mike_Tyson
112, Was it right right away?,555.28,556.3199999999999,8,Mike_Tyson
113, It was a first day. That was your first day,556.3199999999999,558.88,13,Mike_Tyson
114, That was our first thing. Let's try this that was our first day,558.88,561.36,17,Mike_Tyson
115," Wow, and after that day I was in the bed",561.8399999999999,564.24,13,Mike_Tyson
116, They come get the guy to do the fucking shot. Now let you keep me to get me back,564.32,568.32,22,Mike_Tyson
117, I had to say I didn't I couldn't walk I was crying to my wife and I was like wow,568.48,572.96,24,Mike_Tyson
118, And I don't know why um after that I should say this is over. I'm not gonna do it,574.64,578.72,24,Mike_Tyson
119, But um that ego stuff for hey come on please,578.72,581.6800000000001,12,Mike_Tyson
120, Did it?,582.48,583.2,5,Mike_Tyson
121, Does it do you feel like you felt in the old days like when I mean in terms of your mind like the enthusiasm about this,583.2,590.48,28,Mike_Tyson
122, The dude and do the asm yet,590.88,592.88,10,Mike_Tyson
123, Um,593.28,594.16,3,Mike_Tyson
124, Sometimes um I feel I say this is bullshit. I can't be feeling this good,594.16,598.48,19,Mike_Tyson
125, You know and then um,599.9200000000001,601.9200000000001,7,Mike_Tyson
126, And I don't know I think I really am I'm feeling good. I said this bag was because I know the bag is bigger bag,602.4,608.5600000000001,30,Mike_Tyson
127, 20 pounds,609.2,609.84,4,Mike_Tyson
128," I said well this bag wouldn't be moving like this. I'm not hitting it kind of decently, you know",609.84,614.4,26,Mike_Tyson
129, You look good. There's look this is not like there. I've seen guys come back and you see him working out to look sad,614.4,620.16,30,Mike_Tyson
130, And it doesn't look what's exciting about you coming back is how good you look training,620.5600000000001,625.2,20,Mike_Tyson
131, Why not in this day and age but being a real fighter. This is what you know,625.84,630.4,20,Mike_Tyson
132, You see so many people that's in the gym matter fact I've bought people in the gym that kick my ass every day,630.96,635.84,27,Mike_Tyson
133," But then know what's different when you get them in the ring and yeah, the light on them and people eating popcorn and drinking beer and they freak out",636.08,644.16,33,Mike_Tyson
134, ah,644.16,646.16,3,Mike_Tyson
135," So yeah the pressure black. Yes, you're Mike Tyson. Exactly. You understand that",648.9599999999999,654.24,20,Mike_Tyson
136," Yeah, I know if anybody knows how to deal with that pressure. It's you absolutely, but you know you it's good",654.4,659.76,28,Mike_Tyson
137," But if you don't have to doubt you're gonna have a lot of trouble, right? You have to have that doubt",659.76,664.48,27,Mike_Tyson
138," Right, you have to have a little bit of that. Yeah. Now is it this is a",664.56,668.04,22,Mike_Tyson
139, This new phase of your life where all of a sudden you reignited and you want to compete again. This has got to be fun,668.92,675.12,29,Mike_Tyson
140," It is fun, but yeah, it is fun. I do say it's fun, but it's still um",675.12,680.1999999999999,25,Mike_Tyson
141, If apprehensive stuff,681.88,683.88,6,Mike_Tyson
142," You know with apprehensive, but it's still like you said is it's fun",683.88,687.0,19,Mike_Tyson
143, But it seems so exciting like to watch you train and get ready it's like to me,687.36,692.16,20,Mike_Tyson
144, I'm like fuck yeah like what what do you want a man to do?,692.16,694.92,18,Mike_Tyson
145, What do you want a man to just sit around do nothing just wait go for walks do whatever the fuck you want and if you could still do this the way you're doing it why not?,694.92,703.4,41,Mike_Tyson
146, Hey,704.5999999999999,706.5999999999999,3,Mike_Tyson
147, I don't understand it either but I'm gonna do it. I don't understand. I just want to do it and um,706.5999999999999,711.3199999999999,28,Mike_Tyson
148, I feel like I was born to do this stuff,712.36,714.5999999999999,12,Mike_Tyson
149," Well, you certainly were at one point in time in your life",714.92,717.16,15,Mike_Tyson
150, But you had moved on to a different chapter of your life you had completely stopped doing that,717.24,721.24,20,Mike_Tyson
151, You were doing the Tyson ranch thing smoking a lot of weed. Are you stop smoking weed totally much? Yeah pretty much stop,721.24,726.94,27,Mike_Tyson
152, It's gonna stop wow,726.94,728.94,7,Mike_Tyson
153," Wow, that's that's a big change",728.94,730.94,11,Mike_Tyson
154," But when you do something like this is all about change, you know you you listen",730.94,735.78,19,Mike_Tyson
155, You can't continue being a comedian if you're not sharpening,735.78,739.94,15,Mike_Tyson
156, Your psychic up even when you're doing it right here. You're practicing in your comedian act,740.84,744.84,21,Mike_Tyson
157, You know you have to continue to practice the more you practice it if they've you practice it every four years,744.84,750.96,24,Mike_Tyson
158, You'll be better if you only practice it for a month,751.4,754.52,14,Mike_Tyson
159, So the more you do it the better you become do you feel like that now in this comeback that like you are only sort of scratching your,754.92,762.52,30,Mike_Tyson
160, potential because like you're just getting back into shape again a,762.52,766.16,14,Mike_Tyson
161, Year from now you'll be even better shape and you'll be more conditioned to do what you want to do like you're you're in this,766.48,772.64,31,Mike_Tyson
162," Yeah, yeah, you're in this",772.64,774.64,10,Mike_Tyson
163," Rebuilding stage now is in that that's exciting. Yeah, when you go to you",774.92,779.88,20,Mike_Tyson
164, When you go to your doctor these people who have this alternative stuff and you see the development you see the healing process,780.24,786.84,25,Mike_Tyson
165, And you think come on tell me why did it thrive this happening to me,786.84,789.88,17,Mike_Tyson
166, Why not even why guy like me who just got off drugs?,790.36,793.64,15,Mike_Tyson
167, Who just gave up his life and don't care about nothing?,793.64,796.14,15,Mike_Tyson
168," Hit this is happening to him, you know since I married my wife all this good stuff started happening",796.36,801.68,22,Mike_Tyson
169, I said why what is this stuff all about?,801.68,803.68,12,Mike_Tyson
170," Whatever it's all about it's good. I'm like take really great take the money. Yeah, that's what I said",804.6,809.2,28,Mike_Tyson
171, Take my money. I want to watch it. Let's see it and it's not about money because the money's gonna be in charity,809.2,814.9200000000001,30,Mike_Tyson
172, And people under and it's just about doing something good and that from that perspective that could be,814.9200000000001,820.2,21,Mike_Tyson
173, I just like feeling like I'm doing something good for somebody more than myself,820.2,823.88,17,Mike_Tyson
174," That's a beautiful part of it. Yeah, that it is gonna go to charity",824.2,827.1600000000001,19,Mike_Tyson
175, But it's also an exciting matchup and I'm watching Roy workout too and Roy looks fantastic,827.1600000000001,832.0200000000001,21,Mike_Tyson
176, Roy's gonna always look fantastic,832.0200000000001,833.7800000000001,8,Mike_Tyson
177, He was under pound of a way. He's gonna look,833.7800000000001,835.98,14,Mike_Tyson
178, He just really looks good when he got this right Jones junior,835.98,839.28,14,Mike_Tyson
179, I mean that's one of the things that makes this fight so exciting is that,839.28,842.4,18,Mike_Tyson
180, You know Roy is like yourself one of the all-time grades and still looks physically fantastic,842.66,848.46,20,Mike_Tyson
181, Like seeing moving around hitting the pads hand speed looks great. You can't train with anybody looking for do that,848.46,854.16,24,Mike_Tyson
182," Right, well, he always had such an unusual style, you know with very few jobs",854.16,858.54,20,Mike_Tyson
183," We threw left hooks instead of jobs, you know, man Roy always had like one of the strangest styles in all the boxing",858.54,864.44,28,Mike_Tyson
184," It was it was trained, but it was very effective super effective. Yeah, I mean effect just incredibly hard to prepare for too",864.44,870.3800000000001,28,Mike_Tyson
185," Because try to find someone who no one's gonna do that. Yeah, no one can emulate him in the gym now",870.3800000000001,875.6800000000001,26,Mike_Tyson
186, When you decided on a fight and decided on a poem what with a with their other,875.6800000000001,881.24,19,Mike_Tyson
187," I heard that someone that offered you shanning the cannon breaks for a bad knuckle boxing. No, no, it was just",881.24,886.3000000000001,29,Mike_Tyson
188, Tyson,887.48,888.6800000000001,3,Mike_Tyson
189, the Tyson fury,888.6800000000001,890.6800000000001,5,Mike_Tyson
190," With Bob sat Tyson fury and quite other guys, but certain things just happened and it didn't happen and then I'm",890.8399999999999,898.16,26,Mike_Tyson
191, It was holy feel it was shanning with some other guys from,899.1999999999999,903.9599999999999,16,Mike_Tyson
192, MMA and then Roy turned out to be the right guy. I guess we did a survey and Roy popped up the winner,904.5999999999999,911.4799999999999,26,Mike_Tyson
193, Well certainly a giant name,911.4799999999999,913.4799999999999,7,Mike_Tyson
194," Holy if you wanted that yeah, yeah, holy feel would be a great one too",913.9599999999999,916.68,19,Mike_Tyson
195, But it's just having a guy like that that has that big name that is also an all-time great and that also wants to do it,916.68,922.92,31,Mike_Tyson
196, too and they get the public excited,922.92,924.8,9,Mike_Tyson
197, I mean I think it's a perfect fight to get the public exactly,924.8,927.12,16,Mike_Tyson
198, So do you think that once you fight Roy that that'll be it or do you think this is just gonna be the beginning of this new chapter in your life?,927.64,936.4799999999999,35,Mike_Tyson
199, I believe this is just gonna be the beginning or whatever happens happens,936.4799999999999,940.7199999999999,15,Mike_Tyson
200, Life this is pretty interesting being on here talking to you and knowing that,941.12,944.52,16,Mike_Tyson
201, Extended the wave and the people are gonna hear this stuff is pretty interesting because this is now this is true,945.72,951.52,24,Mike_Tyson
202, It's really gonna no longer in my head. I'm stroking it. It's real. It's like wow,951.52,956.9200000000001,26,Mike_Tyson
203," Yeah, it's wow. Yeah, I can't wait man. I want to be there. I want to see it. Hey",957.1600000000001,961.9200000000001,29,Mike_Tyson
204, Down the street here,962.84,964.84,6,Mike_Tyson
205, I'll come back now I forgot the name of the dignity center. Mm-hmm. That's where it's gonna be,964.84,969.72,27,Mike_Tyson
206," Yeah, yeah, and is it gonna be an audience? It can't be an audience. Yeah, right? I believe on it",969.72,973.6800000000001,29,Mike_Tyson
207," You know, I believe on you like I don't know what what I'm gonna say on to us right?",973.6800000000001,977.52,25,Mike_Tyson
208," They call me on people. Yeah, oh family fight group and this is gonna be eight rounds. I believe so yeah",977.52,983.6,26,Mike_Tyson
209, So how did you arrive on eight rounds? Hey listen?,983.88,986.8000000000001,14,Mike_Tyson
210, Beats the hell out of me. I wanted to do the exhibition,988.4,991.08,16,Mike_Tyson
211, I wanted to help the people after what like I eat fucking rounds by now. I'm getting in a condition and we're gonna do this stuff,991.08,996.4,31,Mike_Tyson
212, Well eight rounds gives you enough time to work,997.4,999.4,11,Mike_Tyson
213, Guess people enough time to get excited about it,999.92,1001.92,11,Mike_Tyson
214, When when you think about an eight round fight,1002.72,1005.6,11,Mike_Tyson
215, Do you see see yourself moving into 10 rounds and 12 rounds in the future and how we don't know what the future holds,1006.12,1012.28,27,Mike_Tyson
216, But we're looking forward to you having fun and doing it for,1012.28,1015.0,15,Mike_Tyson
217, Purpose of reason because people were talking about you literally fighting for the title again,1016.36,1020.56,18,Mike_Tyson
218," Hey, I'm not interested. I'm just interested in fighting for the title of giving",1020.56,1023.92,20,Mike_Tyson
219," Okay, okay, so just doing this for good so exciting for you",1024.6399999999999,1029.72,16,Mike_Tyson
220," But also generates a lot of positivity. Yeah, I love that and",1029.72,1034.1599999999999,16,Mike_Tyson
221, I'm so cleaning for some reason because you're giving away charity that you're doing something good,1035.12,1039.68,21,Mike_Tyson
222, Doing it for myself. I guess this doesn't do it for me no more. Right. That makes sense. I didn't do it,1039.68,1045.3999999999999,30,Mike_Tyson
223," Yeah, that makes sense. So it's both things so you get to excite yourself challenge yourself",1046.6,1051.68,22,Mike_Tyson
224, But the good is all going to next,1051.68,1054.48,10,Mike_Tyson
